<!DOCTYPE TEI.2 SYSTEM "micasex.dtd">
<TEI.2 ID="lel140su074">
  <TEIHEADER>
    <FILEDESC>
      <TITLESTMT>
        <TITLE> Japanese Literature Lecture </TITLE>
        <TITLE> Rackham Div: HA </TITLE>
      </TITLESTMT>
      <WORDCOUNT> 8213 </WORDCOUNT>
      <PUBLICATIONSTMT>
        <PUBLISHER> Michigan Corpus of Academic Spoken English, English Language Institute, University of Michigan </PUBLISHER>
        <IDNO> LEL140SU074 </IDNO>
        <AVAILABILITY>
          <P> The MICASE project is owned by the Regents of the University of Michigan, who hold the copyright.  The database has been developed by the English Language Institute, and the web interface by Digital Library Production Services.  The original DAT audiotapes are held in the English Language Institute and may be consulted by bona fide researchers under special arrangements.  The database is freely available at this website for study, teaching and research purposes, and copies of the transcripts may be distributed, as long as either this statement of availability or the citation given below appears in the text.  However, if any portion of this material is to be used for commercial purposes, such as for textbooks or tests, permission must be obtained in advance and a license fee may be required.  Furthermore, some restrictions apply on the citation of specific portions of some of the transcripts in educational presentations and publications; all such restrictions are noted at the end of this statement.  For further information about copyright permissions, please contact Dr. Sarah Briggs at slbriggs@umich.edu. </P>
          <P> The recommended citation for MICASE is: R. C. Simpson, S. L. Briggs, J. Ovens, and J. M. Swales.  (1999) The Michigan Corpus of Academic Spoken English.  Ann Arbor, MI:  The Regents of the University of Michigan </P>
          <P> RESTRICTIONS ON CITATION OF EXAMPLES:  NONE </P>
        </AVAILABILITY>
      </PUBLICATIONSTMT>
      <SOURCEDESC>
        <RECORDINGSTMT>
          <RECORDING DUR="44">
            <DATE> November 29, 1999 </DATE>
            <EQUIPMENT>
              <P> TASCAM Digital Audio Tape Recorder with two external microphones </P>
            </EQUIPMENT>
            <RESPSTMT>
              <NAME> Bonnie Malczewski </NAME>
              <RESP> Recording </RESP>
              <NAME> Rodney Pratt </NAME>
              <RESP> Transcribing </RESP>
              <NAME> Amy Burke </NAME>
              <RESP> Rechecking </RESP>
              <NAME> Shannon Allen </NAME>
              <RESP> Proofreading </RESP>
              <NAME> Chris Frost </NAME>
              <RESP> Final Editing, 1/25/02 </RESP>
            </RESPSTMT>
          </RECORDING>
        </RECORDINGSTMT>
      </SOURCEDESC>
    </FILEDESC>
    <PROFILEDESC>
      <LANGUSAGE>
        <P> Primary Discourse Mode: MLG </P>
        <P> New Interactivity Rating: MM </P>
        <LANGUAGE ID="NS"> Native Speaker </LANGUAGE>
      </LANGUSAGE>
      <PARTICDESC>
        <PERSONGRP ROLE="Students" SIZE="60"></PERSONGRP>
        <PERSONGRP ROLE="Speakers" SIZE="7"></PERSONGRP>
        <PERSON ID="S1" LANG="NS" ROLE="JF, Instructor" SEX="M" RESTRICT="NONE" AGE="3"></PERSON>
        <PERSON ID="S2" LANG="NS" ROLE="SU, Student" SEX="F" RESTRICT="NONE" AGE="1"></PERSON>
        <PERSON ID="S3" LANG="NS" ROLE="SU, Student" SEX="F" RESTRICT="NONE" AGE="1"></PERSON>
        <PERSON ID="S4" LANG="NS" ROLE="JU, Student" SEX="M" RESTRICT="NONE" AGE="1"></PERSON>
        <PERSON ID="S5" LANG="NS" ROLE="JG, GSI" SEX="F" RESTRICT="NONE" AGE="3"></PERSON>
        <PERSON ID="S6" LANG="NS" ROLE="SU, Student" SEX="M" RESTRICT="NONE" AGE="1"></PERSON>
        <PERSON ID="S7" LANG="NS" ROLE="SU, Student" SEX="M" RESTRICT="NONE" AGE="1"></PERSON>
        <PERSON ID="SS" LANG="NS" ROLE="UN, Unkown" SEX="U" RESTRICT="NONE" AGE="0"></PERSON>
        <PERSON ID="SU-f" LANG="NS" ROLE="SU, Student" SEX="F" RESTRICT="NONE" AGE="1"></PERSON>
        <PERSON ID="SU-m" LANG="NS" ROLE="SU, Student" SEX="M" RESTRICT="NONE" AGE="1"></PERSON>
      </PARTICDESC>
      <SETTINGDESC>
        <SETTING>
          <P> Auditorium, Modern Language Building </P>
        </SETTING>
      </SETTINGDESC>
    </PROFILEDESC>
  </TEIHEADER>
  <TEXT>
    <BODY>
      <U WHO="S1"> okay thankful. something. okay um, we have a list of names 
        <EVENT DESC="BREAK IN RECORDING" />
         act eleven, uh we begin with a list of the, supposedly forty-seven. actually if you read the footnotes, forty-six 
        <FOREIGN> ronin </FOREIGN>
         forty-six samurai supposed to be forty-seven, who carried out the attack, and, we get this whole list of names and they're all equated with the Japanese syllabary, the Japanese Kana. uh there're forty-seven Kana. i guess that's a good way to remember how many Kana there are. um, and the original name the real name of this play this particular version, is, uh oh, where's the chalk? there it is... uh, is, it's in the notes uh, 
        <WRITING> Kanadehon, Chushingura </WRITING>
        <EVENT DUR=":04" DESC="PAUSE WHILE WRITING" />
         uh Kana, remember Kana? is the native Japanese s- uh, syllabary. Kanadehon, and Kanadehon the whole thing is a copybook of Kana. it's a kind of a copybook that people would use for studying Kana. uh and it it's given this name because there are forty-seven 
        <FOREIGN> ronin, </FOREIGN>
         the forty-seven samurai. um and so, it's equivalent to the forty-seven, letters in the syllabary. and so in this beginning of act eleven we get, sort of the list, of all of them, supposedly all of them. the note's kind of interesting it it noted that, the names are in fact different though, they conflict with the names mentioned in act ten. and that was a problem because we had three authors for this particular play and they obviously didn't get all their names, correct with each other. um, okay, in this act, Yuranosuke and his men go to attack Enya Hangan at his castle, and they break in, and they're attacking, and you remember, the samurai of the two neighboring castles and at the at the places nearby hear all the commotion, and they come out to see what's going on. on page one-seventy-five. and they come out and they say 
        <SEG TYPE="READING"> what are all those wild noises coming from your mansion? we hear shouts, swords clashing, the cries of archers. what's going on? is it a drunken brawl? have bandits broken in? or has someone_ has some sudden decree come from the government? our master commands us to find out. narrator. their voices ring loudly. Yuranosuke answers at once. </SEG>
         and remember Yuranosuke is our model of samurai behavior, he's our, ideal samurai here. and he says, in a loud voice h- he doesn't hide from anyone he says, 
        <SEG TYPE="READING"> we are the retainers of Enya Hangan. forty and more of us are fighting with every means at our disposal to avenge our master. i am Oboshi Yuranosuke and this is Hara Goemon, we have no quarrel with Takauji or his brother. nor do we bear any grudge against either Lord Nikki or Lord Ishido. so we promise to do nothing irresponsible. i have ordered our men to take the strictest precautions against fire. so you need have no worries on that account. we only ask, we ask only that you peaceably refrain from interfering. but if you can't turn a deaf ear to what happens in a neighbor's house, and send in reinforcements, we will have no choice but to retaliate with our arrows. </SEG>
         he says we don't have a fight with you. but uh, but if you mess with us if you get in the way we'll kill you too, because, this is, this is what we have to do. and, the narrator says 
        <SEG TYPE="READING"> the men of both houses, hearing this bold proclamation shout back. the samurai say, what superb courage. every man who serves a master should behave as you are doing. call if you have any need of us. withdraw the lanterns. </SEG>
         so they they all applaud and they say hey, great, right on you, kill Moronao there. 
        <EVENT WHO="SS" DESC="LAUGH" />
         uh, at least uh, they're not gonna take sides they_ oh this is a good thing uh, vengeance revenge in this case this is what you oughta be doing and, and they praise them as a result, it's kinda interesting. okay. so, they, they take over the castle, they kill lots of people there but at first they can't find Moronao it turns out that he's hiding, he's run away and, and he's cowering in fear hiding but one of them, the narrator on page one-seventy-six says, 
        <SEG TYPE="READING"> Yazama Jutaro Shigeyuki drags in Moronao all but carrying him in his arms. </SEG>
         he finds him. Jutaro says, 
        <SEG TYPE="READING"> hear me everyone, i found him hiding in the wood shed and took him alive. narrator. the others all rush up, bolstered in spirits like a flower touched with dew. Yuranosuke. nobly done. a tremendous feat. but we mustn't kill him hastily. after all he served for a time as a high officer of the government. the proper decorum must be observed, even when killing him. </SEG>